{
  "manifestVersion": "PreCandidateFreezeV2",
  "status": "READY_FOR_OWNER_FREEZE_COMMIT",
  "futureAnchor": "freezeCommitSha",
  "artifacts": {
    "benchmark/protocol/controlled-subject-profile-v1.json": "77b983443329fec271f15a78f222552c1a04a28c5c1a5b85a4a69b6509c3e62f",
    "benchmark/protocol/controlled-mutation-spec-v1.json": "9426b0807c14c1bc4a28e43fbd4af8446230f25eb20fd10069f19e9077807ab4",
    "benchmark/protocol/controlled-build-contract-v1.json": "a58471b286b8304c02de402161fd18770db1a16bbc8fc4d3e4c23f56094db708",
    "benchmark/protocol/controlled-profile-acceptance-matrix-v1.json": "48f58e625b2a98a1d6ee57724c0798f287d33bfb06c158168a433c00712e2284",
    "benchmark/protocol/single-case-v2.json": "75587dd3b1df312608364601affd1ec8343c16219e9e12f67f0297c9ac542388",
    "benchmark/schemas/controlled-challenge-manifest-v1.schema.json": "946eb96f22ee5bda624ba61de563515d1e45b83e7f3efb657e0084894b500659",
    "benchmark/schemas/controlled-generation-evidence-v2.schema.json": "d0c6b2cf83cb2467a85b79e54ce990b378fbb6dd1c1ea4c93e2477f106f22540",
    "benchmark/schemas/controlled-subject-profile-v1.schema.json": "f3c1e2a97a1649fa14400a71a1816edf611023440f03001fc0617b2d69c70ec3",
    "benchmark/schemas/controlled-benchmark-subject-receipt-v1.schema.json": "6224a97dbc6a1675080c1b83259c5490e6c05e55c5c669c3df7b6382bd054b20",
    "benchmark/schemas/single-case-result-v1.schema.json": "435757fbef66e068c5f6d0ccf5de7c8ec3ddcf30d16b2deb65fb0f3595eca442",
    "benchmark/protocol/freeze-executable-closure-v2.json": "85fb631de97c8e7dc8253eaa833d9f5bb35fceaaf95c5466da320f55b5e2c904",
    "benchmark/protocol/freeze-authority-supersession-v1.json": "4c81d0d7423e0e5f2a75af3b66d7023e019c0abaa028ee54aa6e003016afa9e6",
    "benchmark/protocol/generation-contract-supersession-v1.json": "c4ba81434c077f0b0fb9895712906cc149cdb535043fd91c46b3d6cfdf5f7f86",
    "benchmark/protocol/freeze-authority-v2-acceptance-matrix.json": "80517183ab11550c2e09d83533090c8d707097502f7ce266643dd32c200cb112",
    "benchmark/schemas/freeze-executable-closure-v2.schema.json": "89d1ab1da3f3bae6f0e37dc88f265ec44293cb24d40137dc83231883c931a224",
    "benchmark/schemas/pre-candidate-freeze-v2.schema.json": "33c2084e2d75c3b46d0149d4a30bf76a3fdf454cbc6f6cf80f871da4e3ac35e8",
    "benchmark/schemas/freeze-authority-v2-acceptance-matrix.schema.json": "286c9669325ff34aa535bce8741c89f7276b3de967d88211c99046fbd9c5a035",
    "scripts/cat-prepare-freeze-authority-v2.ts": "a4c6ef4d86d93ec18c5a0658ad9b817e322b40cf3248664ca48a09bed62a9665",
    "tests/freeze-authority-v2.test.ts": "21f1826445ad60320b8a09ac80e6f7c1e5f3075a09a8be60a1f4f47ca999bf03",
    "tests/controlled-candidate-generator.test.ts": "08a94fb9cd9a230af3f39aae9f823a9e6bbcb7413d6ad2db93c0dc79d751b993",
    "docs/BENCHMARK_PROTOCOL.md": "4dd6b5fb7997dad219131b51d3518681e5ae858904456e827d65cd05b016b00c",
    "scripts/Invoke-CatTrustedFreezeRunnerV2.ps1": "afa75afab3b9872f9e02c66e76e94c353f6a6d390159d17500acf9dcdb82f3b1",
    "tests/controlled-subject-profile.test.ts": "cbb256b164265305deebbc479704820c4b9ce34ed5b69ebc8ad05f16c6136c47",
    "tests/cat-trusted-freeze-runner-v2.test.ts": "f92e3bc19a7e9c8ad734ad7690ce2a07b740c1b490c6ebea07f674a909cceb0c",
    ".gitattributes": "e0d04edd573f3413937999325946486331020424016e85e1a5019603811ddf8d"
  },
  "executableClosureVersion": "FreezeExecutableClosureV2",
  "executableClosureSha256": "8399cf5007515cb372d1d1b96945a5f367fa57cd2736f6962e80e120191095ba",
  "profileSha256": "77b983443329fec271f15a78f222552c1a04a28c5c1a5b85a4a69b6509c3e62f",
  "mutationSpecSha256": "9426b0807c14c1bc4a28e43fbd4af8446230f25eb20fd10069f19e9077807ab4",
  "buildContractSha256": "a58471b286b8304c02de402161fd18770db1a16bbc8fc4d3e4c23f56094db708",
  "sameCandidateProtocolSha256": "75587dd3b1df312608364601affd1ec8343c16219e9e12f67f0297c9ac542388",
  "acceptanceMatrixSha256": "48f58e625b2a98a1d6ee57724c0798f287d33bfb06c158168a433c00712e2284",
  "dependencyIdentityVersion": "DependencyInventoryV1",
  "dependencyIdentitySha256": "a0923da0a3195e2384bb2b56ffbcd45c891cd631cc28433ed464c27527980849",
  "dependencyLockSha256": "21c448532a8e400504c800df67ad246d6d9461c7883fc7e68861d3960ebc3ce8",
  "executionInfrastructureIdentitySha256": "1e99ea7352f8d8b195a4d8e0b3637ace24ecb044baa4870858914548d430c5c2",
  "generatorSourceIdentitySha256": "8399cf5007515cb372d1d1b96945a5f367fa57cd2736f6962e80e120191095ba",
  "controlledGateSourceIdentitySha256": "8399cf5007515cb372d1d1b96945a5f367fa57cd2736f6962e80e120191095ba",
  "sameCandidateContractSha256": "75587dd3b1df312608364601affd1ec8343c16219e9e12f67f0297c9ac542388",
  "attributePolicyPath": ".gitattributes",
  "trustedRunnerVersion": "TrustedCommittedRunnerV1",
  "trustedRunnerEntrypointPath": "scripts/cat-trusted-freeze-runner-v2.ts",
  "trustedRunnerSourceIdentitySha256": "020a5b5ed37efacdb4a06d4ccf5d372d946beec0646a714c899a8d3afca04e87",
  "attributePolicySha256": "e0d04edd573f3413937999325946486331020424016e85e1a5019603811ddf8d",
  "worktreeNormalizationPolicy": "CRLF_TO_LF_V1"
}
